{
  "$schema": "./schemas/features.schema.json",
  "registryVersion": "1.2.0",
  "generated": "2026-10-05",
  "tiers": {
    "1": "Ships in the TypeScript app. Computed in pass one and pass two. Appears in the student DOCX and the cohort CSV.",
    "2": "Python research layer. Computed from the archived transcript JSON. Appears in the research export only.",
    "3": "Python research layer. Needs the archived 48 kHz audio, forced alignment, or an acoustic toolkit. Appears in the research export only.",
    "4": "Needs people: annotation of a validation subset, stimulated recall, listener studies, or an extra task such as an L1 recording. Listed so the archive keeps what those studies need."
  },
  "inputs": {
    "words": "Word-level transcript with start, end, confidence, punctuated_word, channel, isFinal, pass.",
    "energy": "Per-channel dBFS frames at 20 ms.",
    "audio": "Archived 48 kHz 16-bit stereo WAV.",
    "alignment": "Phone- and syllable-level timings from a forced aligner run on the archive.",
    "roster": "Pseudonymous participant IDs, consent status, course and unit metadata.",
    "instructor": "Instructor live score and later rubric scores, stored apart from student outputs.",
    "rawAsr": "Every Deepgram message, interim and final, both passes, stored verbatim.",
    "verbatim": "CrisperWhisper verbatim transcript per channel with word timestamps (research layer).",
    "phones": "Free phone recognition per channel (wav2vec2 eSpeak phone model) aligned to dictionary forms."
  },
  "features": [
    {
      "id": "speech_rate_wpm",
      "tier": 1,
      "construct": "speed",
      "unit": "pruned words per minute of window time",
      "inputs": [
        "words"
      ],
      "formula": "prunedWordCount / (windowMs / 60000)",
      "params": {},
      "reference": "Kormos & Dénes 2004; Suzuki et al. 2021",
      "caveats": [
        "counts words; tier 3 gives syllables",
        "pruned view; a raw twin reports the same measure with every word kept"
      ]
    },
    {
      "id": "speech_rate_raw_wpm",
      "tier": 1,
      "construct": "speed",
      "unit": "raw words per minute of window time",
      "inputs": [
        "words"
      ],
      "formula": "rawWordCount / (windowMs / 60000)",
      "params": {},
      "reference": "Kormos & Dénes 2004",
      "caveats": []
    },
    {
      "id": "articulation_rate_wpm",
      "tier": 1,
      "construct": "speed",
      "unit": "pruned words per minute of phonation time",
      "inputs": [
        "words"
      ],
      "formula": "prunedWordCount / (phonationMs / 60000)",
      "params": {
        "pauseThresholdMs": [
          200,
          350
        ]
      },
      "reference": "Préfontaine et al. 2016",
      "caveats": [
        "counts words; tier 3 gives syllables",
        "pruned view; a raw twin reports the same measure with every word kept"
      ]
    },
    {
      "id": "articulation_rate_sps_est",
      "tier": 1,
      "construct": "speed",
      "unit": "estimated syllables per second of phonation time",
      "inputs": [
        "words"
      ],
      "formula": "sum(dictSyllables(word)) / (phonationMs / 1000)",
      "params": {
        "dictionary": "cmudict",
        "fallback": "orthographic vowel-group count"
      },
      "reference": "Préfontaine et al. 2016",
      "caveats": [
        "pass two only",
        "dictionary estimate; tier 3 replaces with aligned syllables"
      ]
    },
    {
      "id": "phonation_time_ratio",
      "tier": 1,
      "construct": "speed",
      "unit": "ratio",
      "inputs": [
        "words"
      ],
      "formula": "phonationMs / windowMs",
      "params": {
        "pauseThresholdMs": [
          200,
          350
        ]
      },
      "reference": "Kormos & Dénes 2004",
      "caveats": []
    },
    {
      "id": "silent_pause_rate",
      "tier": 1,
      "construct": "breakdown",
      "unit": "pauses per minute of phonation time",
      "inputs": [
        "words"
      ],
      "formula": "pauseCount(threshold) / (phonationMs / 60000)",
      "params": {
        "pauseThresholdMs": [
          200,
          350
        ]
      },
      "reference": "Gao, Sun & Li 2025; Gao & Sun 2025",
      "caveats": [
        "within-turn gaps only"
      ]
    },
    {
      "id": "silent_pause_mean_ms",
      "tier": 1,
      "construct": "breakdown",
      "unit": "ms",
      "inputs": [
        "words"
      ],
      "formula": "mean(pauseDurations(threshold))",
      "params": {
        "pauseThresholdMs": [
          200,
          350
        ]
      },
      "reference": "Suzuki et al. 2021",
      "caveats": []
    },
    {
      "id": "silent_pause_max_ms",
      "tier": 1,
      "construct": "breakdown",
      "unit": "ms",
      "inputs": [
        "words"
      ],
      "formula": "max(pauseDurations(threshold))",
      "params": {
        "pauseThresholdMs": [
          200,
          350
        ]
      },
      "reference": "Suzuki et al. 2021",
      "caveats": []
    },
    {
      "id": "silent_pause_mid_clause_count",
      "tier": 1,
      "construct": "breakdown",
      "unit": "count",
      "inputs": [
        "words"
      ],
      "formula": "count(pauses where previous punctuated_word has no clause-final punctuation)",
      "params": {
        "pauseThresholdMs": [
          200,
          350
        ],
        "boundaryMethod": "punctuation"
      },
      "reference": "Gao, Sun & Li 2025; Matsuura et al. 2022",
      "caveats": [
        "punctuation boundary is a proxy for AS-unit boundary"
      ]
    },
    {
      "id": "silent_pause_end_clause_count",
      "tier": 1,
      "construct": "breakdown",
      "unit": "count",
      "inputs": [
        "words"
      ],
      "formula": "count(pauses where previous punctuated_word ends with . ? ! , ;)",
      "params": {
        "pauseThresholdMs": [
          200,
          350
        ],
        "boundaryMethod": "punctuation"
      },
      "reference": "Gao, Sun & Li 2025",
      "caveats": [
        "punctuation boundary is a proxy for AS-unit boundary"
      ]
    },
    {
      "id": "mean_length_of_run",
      "tier": 1,
      "construct": "breakdown",
      "unit": "pruned words between pauses",
      "inputs": [
        "words"
      ],
      "formula": "mean(prunedWordsPerRun(threshold))",
      "params": {
        "pauseThresholdMs": [
          200,
          350
        ]
      },
      "reference": "Kormos & Dénes 2004; Préfontaine et al. 2016",
      "caveats": [
        "pruned view; a raw twin reports the same measure with every word kept"
      ]
    },
    {
      "id": "filled_pause_count",
      "tier": 1,
      "construct": "repair",
      "unit": "count",
      "inputs": [
        "words"
      ],
      "formula": "count(word in fillerTokens)",
      "params": {
        "fillerTokens": [
          "uh",
          "um"
        ],
        "deepgramFlag": "filler_words=true"
      },
      "reference": "Suzuki et al. 2021",
      "caveats": [
        "Deepgram transcribes uh and um only; add Korean fillers to fillerTokens if they appear as words"
      ]
    },
    {
      "id": "filled_pause_rate",
      "tier": 1,
      "construct": "repair",
      "unit": "per minute of phonation time",
      "inputs": [
        "words"
      ],
      "formula": "filled_pause_count / (phonationMs / 60000)",
      "params": {},
      "reference": "Gao & Sun 2025",
      "caveats": []
    },
    {
      "id": "repetition_count",
      "tier": 1,
      "construct": "repair",
      "unit": "count",
      "inputs": [
        "words"
      ],
      "formula": "count(word[i] == word[i-1]) + count(bigram[i] == bigram[i-1])",
      "params": {},
      "reference": "Suzuki et al. 2021",
      "caveats": [
        "final words only"
      ]
    },
    {
      "id": "false_start_count",
      "tier": 1,
      "construct": "repair",
      "unit": "count",
      "inputs": [
        "words"
      ],
      "formula": "count(1-3 word fragment followed by restart sharing no token, before a boundary)",
      "params": {
        "maxFragmentWords": 3
      },
      "reference": "Gao & Sun 2025",
      "caveats": [
        "pass two only",
        "heuristic; tier 2 adds a parsed version"
      ]
    },
    {
      "id": "turn_count",
      "tier": 1,
      "construct": "interaction",
      "unit": "count",
      "inputs": [
        "words"
      ],
      "formula": "count(turns on this channel)",
      "params": {
        "turnThresholdMs": 1500
      },
      "reference": "Galaczi 2014; Gao & Sun 2025",
      "caveats": [
        "participation measure; stays out of the index"
      ]
    },
    {
      "id": "mean_turn_length_words",
      "tier": 1,
      "construct": "interaction",
      "unit": "pruned words",
      "inputs": [
        "words"
      ],
      "formula": "mean(prunedWordsPerTurn)",
      "params": {},
      "reference": "Galaczi 2014",
      "caveats": []
    },
    {
      "id": "talk_time_share",
      "tier": 1,
      "construct": "interaction",
      "unit": "ratio",
      "inputs": [
        "words",
        "energy"
      ],
      "formula": "thisPhonationMs / (thisPhonationMs + partnerPhonationMs)",
      "params": {},
      "reference": "Ortaçtepe Hart 2020",
      "caveats": [
        "pair-level; depends on cross-talk rejection"
      ]
    },
    {
      "id": "response_latency_mean_ms",
      "tier": 1,
      "construct": "interaction",
      "unit": "ms",
      "inputs": [
        "words"
      ],
      "formula": "mean(thisFirstWordStart - partnerLastWordEnd) over transitions",
      "params": {},
      "reference": "Eskin 2026",
      "caveats": [
        "negative values are overlaps; reported separately"
      ]
    },
    {
      "id": "response_latency_median_ms",
      "tier": 1,
      "construct": "interaction",
      "unit": "ms",
      "inputs": [
        "words"
      ],
      "formula": "median(...)",
      "params": {},